{
  "schema": "agent-mindmap-observability/v1",
  "generated_at": "2026-10-24T07:00:00+00:00",
  "mode": "live",
  "machine": {
    "id": "mac-3f9a21c4",
    "label": "Mac B",
    "role": "reader",
    "platform": "darwin-arm64"
  },
  "collector": {
    "status": "unknown",
    "last_t3_poll": null,
    "stale_after_sec": null,
    "reason": "Collector not running on this machine"
  },
  "feed": {
    "status": "unpublished",
    "last_published_at": null,
    "last_observed_at": null,
    "trusted_until": null,
    "owner": null,
    "owned_by_this_machine": null,
    "last_error": null
  },
  "quota": {
    "pools": [
      {
        "id": "claude-1",
        "label": "Claude 1",
        "provider": "claude",
        "account_alias": "claude-1",
        "plan": null,
        "status": "UNKNOWN",
        "windows": [],
        "source": {
          "kind": "none",
          "method": "no collector configured",
          "supported_programmatically": false
        },
        "observed_at": null,
        "expires_at": null,
        "reason": "No sourced, timestamped reading"
      },
      {
        "id": "claude-2",
        "label": "Claude 2",
        "provider": "claude",
        "account_alias": "claude-2",
        "plan": null,
        "status": "UNKNOWN",
        "windows": [],
        "source": {
          "kind": "none",
          "method": "no collector configured",
          "supported_programmatically": false
        },
        "observed_at": null,
        "expires_at": null,
        "reason": "No sourced, timestamped reading"
      },
      {
        "id": "cursor-premium",
        "label": "Cursor Premium",
        "provider": "cursor",
        "account_alias": "cursor-premium",
        "plan": null,
        "status": "UNKNOWN",
        "windows": [],
        "source": {
          "kind": "none",
          "method": "no collector configured",
          "supported_programmatically": false
        },
        "observed_at": null,
        "expires_at": null,
        "reason": "No sourced, timestamped reading"
      },
      {
        "id": "devin-free",
        "label": "Devin Free",
        "provider": "devin",
        "account_alias": "devin-free",
        "plan": null,
        "status": "UNKNOWN",
        "windows": [],
        "source": {
          "kind": "none",
          "method": "no collector configured",
          "supported_programmatically": false
        },
        "observed_at": null,
        "expires_at": null,
        "reason": "No sourced, timestamped reading"
      },
      {
        "id": "codex",
        "label": "Codex",
        "provider": "codex",
        "account_alias": "codex",
        "plan": null,
        "status": "UNKNOWN",
        "windows": [],
        "source": {
          "kind": "none",
          "method": "no collector configured",
          "supported_programmatically": false
        },
        "observed_at": null,
        "expires_at": null,
        "reason": "No sourced, timestamped reading"
      }
    ],
    "collected_at": null
  },
  "notes": [
    "Fresh install: nothing has been collected yet"
  ]
}
